{
  "version": "1.0.0",
  "lastUpdated": "2025-01-16",
  "metadata": {
    "title": "California Water Permit Finder",
    "description": "Decision tree to help identify which California water permits you may need",
    "disclaimer": "This tool provides general guidance only. Always consult with your Regional Water Board for specific requirements."
  },
  "nodes": {
    "start": {
      "id": "start",
      "type": "question",
      "title": "What type of project or activity are you planning?",
      "helpText": "Select the category that best describes your project. If your project spans multiple categories, you may need multiple permits.",
      "options": [
        {
          "id": "construction",
          "label": "Construction or Land Development",
          "description": "Building projects, grading, excavation, demolition",
          "icon": "construction",
          "next": "construction_size"
        },
        {
          "id": "industrial",
          "label": "Industrial or Manufacturing",
          "description": "Factories, processing plants, warehouses with industrial operations",
          "icon": "factory",
          "next": "industrial_discharge"
        },
        {
          "id": "agriculture",
          "label": "Agriculture or Farming",
          "description": "Crops, livestock, wineries, dairies, cannabis cultivation",
          "icon": "agriculture",
          "next": "ag_type"
        },
        {
          "id": "wastewater",
          "label": "Wastewater Treatment or Discharge",
          "description": "Sewage treatment, septic systems, industrial process water",
          "icon": "water_drop",
          "next": "ww_destination"
        },
        {
          "id": "restoration",
          "label": "Habitat Restoration",
          "description": "Stream restoration, wetland enhancement, invasive species removal",
          "icon": "eco",
          "next": "restoration_size"
        },
        {
          "id": "water_use",
          "label": "Water Diversion or Storage",
          "description": "Pumping from streams/rivers, reservoirs, wells, water storage",
          "icon": "waves",
          "next": "water_source"
        },
        {
          "id": "municipal",
          "label": "Municipal or Government Operations",
          "description": "City/county stormwater systems, public facilities",
          "icon": "account_balance",
          "next": "municipal_type"
        },
        {
          "id": "dredge_fill",
          "label": "Dredging or Fill in Waterways",
          "description": "Placing fill in wetlands, streams, or coastal waters; dredging channels",
          "icon": "landscape",
          "next": "dredge_federal"
        }
      ]
    },

    "construction_size": {
      "id": "construction_size",
      "type": "question",
      "title": "How much land will be disturbed?",
      "helpText": "Include all clearing, grading, excavation, and demolition activities. Projects that are part of a larger development are considered together.",
      "options": [
        {
          "id": "less_than_1_acre",
          "label": "Less than 1 acre",
          "description": "Small projects, single lots, minor grading",
          "next": "construction_small_common_plan"
        },
        {
          "id": "1_to_5_acres",
          "label": "1 to 5 acres",
          "description": "Medium residential, small commercial",
          "next": "construction_surface_discharge"
        },
        {
          "id": "more_than_5_acres",
          "label": "More than 5 acres",
          "description": "Large developments, subdivisions, major commercial",
          "next": "construction_surface_discharge"
        }
      ]
    },

    "construction_small_common_plan": {
      "id": "construction_small_common_plan",
      "type": "question",
      "title": "Is this part of a larger common plan of development?",
      "helpText": "If your project is part of a phased development or subdivision that totals 1+ acres, the entire plan counts toward the threshold.",
      "options": [
        {
          "id": "yes_common_plan",
          "label": "Yes, total plan is 1+ acres",
          "description": "Part of subdivision, phased project, or multiple lots",
          "next": "construction_surface_discharge"
        },
        {
          "id": "no_standalone",
          "label": "No, standalone small project",
          "description": "Truly independent project under 1 acre",
          "next": "construction_waterway"
        }
      ]
    },

    "construction_waterway": {
      "id": "construction_waterway",
      "type": "question",
      "title": "Will your project involve work in or near waterways?",
      "helpText": "This includes streams, wetlands, drainage channels, or flood control facilities.",
      "options": [
        {
          "id": "yes_waterway",
          "label": "Yes, work in or adjacent to waterways",
          "description": "Stream crossings, wetland impacts, drainage modifications",
          "next": "result_small_construction_waterway"
        },
        {
          "id": "no_waterway",
          "label": "No waterway involvement",
          "description": "Upland construction only",
          "next": "result_small_construction_no_permit"
        }
      ]
    },

    "construction_surface_discharge": {
      "id": "construction_surface_discharge",
      "type": "question",
      "title": "Where will stormwater from your site drain?",
      "helpText": "During and after construction, where does water leaving your site go?",
      "options": [
        {
          "id": "surface_water",
          "label": "To storm drains, streams, or other surface water",
          "description": "Most urban and suburban sites",
          "next": "construction_risk_assessment"
        },
        {
          "id": "contained_onsite",
          "label": "Contained and infiltrated on-site",
          "description": "Retention basins, infiltration galleries",
          "next": "construction_risk_assessment"
        }
      ]
    },

    "construction_risk_assessment": {
      "id": "construction_risk_assessment",
      "type": "question",
      "title": "What is the terrain like?",
      "helpText": "This helps determine your risk level under the Construction General Permit.",
      "options": [
        {
          "id": "flat_stable",
          "label": "Mostly flat with stable soils",
          "description": "Slopes under 5%, no erosion concerns",
          "next": "result_cgp_level1"
        },
        {
          "id": "moderate_slopes",
          "label": "Moderate slopes (5-15%)",
          "description": "Some erosion potential, typical hillside",
          "next": "construction_sensitive_waters"
        },
        {
          "id": "steep_slopes",
          "label": "Steep slopes (>15%) or erosive soils",
          "description": "High erosion potential, unstable areas",
          "next": "construction_sensitive_waters"
        }
      ]
    },

    "construction_sensitive_waters": {
      "id": "construction_sensitive_waters",
      "type": "question",
      "title": "Does your site discharge to sensitive or impaired waters?",
      "helpText": "Check the 303(d) list for your receiving water body. Sensitive waters include those with sediment TMDLs or habitat for endangered species.",
      "options": [
        {
          "id": "not_sensitive",
          "label": "No known impairments",
          "description": "Standard receiving waters",
          "next": "result_cgp_level2"
        },
        {
          "id": "sensitive_tmdl",
          "label": "Yes, water has TMDL or is impaired",
          "description": "Listed on 303(d) for sediment, nutrients, or other pollutants",
          "next": "result_cgp_level3"
        }
      ]
    },

    "industrial_discharge": {
      "id": "industrial_discharge",
      "type": "question",
      "title": "What type of discharge does your facility have?",
      "helpText": "Consider both process wastewater and stormwater runoff from your site.",
      "options": [
        {
          "id": "stormwater_only",
          "label": "Stormwater runoff only",
          "description": "No process water discharge, just rain runoff from industrial areas",
          "next": "industrial_exposure"
        },
        {
          "id": "process_wastewater",
          "label": "Process wastewater to surface water",
          "description": "Industrial process water discharged to streams, rivers, or ocean",
          "next": "result_individual_npdes"
        },
        {
          "id": "land_application",
          "label": "Process wastewater to land",
          "description": "Discharge to evaporation ponds, land application, or infiltration",
          "next": "result_individual_wdr"
        },
        {
          "id": "to_sewer",
          "label": "All discharge goes to public sewer",
          "description": "No direct environmental discharge",
          "next": "industrial_stormwater_check"
        }
      ]
    },

    "industrial_exposure": {
      "id": "industrial_exposure",
      "type": "question",
      "title": "Are industrial materials exposed to stormwater?",
      "helpText": "Consider outdoor storage areas, loading docks, equipment storage, waste materials, and raw materials.",
      "options": [
        {
          "id": "yes_exposure",
          "label": "Yes, some industrial materials are outdoors",
          "description": "Storage areas, equipment, materials exposed to rain",
          "next": "result_igp"
        },
        {
          "id": "no_exposure",
          "label": "No, all industrial activities are covered",
          "description": "Everything happens indoors or under cover",
          "next": "result_nec"
        }
      ]
    },

    "industrial_stormwater_check": {
      "id": "industrial_stormwater_check",
      "type": "question",
      "title": "Does stormwater from your site reach surface waters?",